{
  "instructions": "Replace this text with the scientific task, necessary context, and operational instructions.",
  "input": [],
  "submission": [
    {
      "path": "submission.json",
      "format": "json",
      "description": "Replace this text with the required artifact contents and format.",
      "has_template": true
    }
  ],
  "environment": [],
  "requirement": [],
  "limitation": {}
}
